variabel,huidig,2050_min,2050_max,2100_min,2100_max
Gemiddelde temperatuur,28.1,28.8,29.3,28.8,31.3
Gemiddelde temperatuur droog seizoen,28.1,28.7,29.3,28.7,31.3
Gemiddelde temperatuur nat seizoen,29.3,30,30.6,30,32.6
Gemiddelde neerslag,526.1,458.7592,525.0478,281.4635,525.0478
Gemiddelde neerslag droog seizoen,169.53,139.52319,164.78316,91.5462,164.95269
Gemiddelde neerslag nat seizoen,344.57,297.36391,350.77226,339.74602,182.96667
Gemiddelde wind,8.1,8.1324,8.4564,8.1405,8.9343
Gemiddelde wind droog seizoen,8,8.024,8.224,8.016,8.552
Gemiddelde wind nat seizoen,7.6,7.6532,7.9344,7.6228,8.5804
